{
    "core":{
        "default_fmt": "data/{date}/#{counter}_{name}_{time}",
        "register_magic": false,
        "import_legacy_api": false,
        "db_location": "~/experiments.db",
        "db_debug": false,
        "loglevel": "WARNING",
        "file_loglevel": "INFO"
    },
    "logger": {
        "start_logging_on_import": "if_telemetry_set_up",
        "console_level": "WARNING",
        "file_level": "INFO",
        "logger_levels":{
            "pyvisa": "INFO"
        }
    },
    "subscription":{
        "subscribers":{
            "QCPlot":{
                "factory": "qcplotutils.qcodes_dataset.QCPlotDatasetSubscriber",
                "factory_kwargs":{
                    "log": false
                },
                "subscription_kwargs":{
                    "min_wait": 0,
                    "min_count": 1,
                    "callback_kwargs": {}
                }
            }
        },
        "default_subscribers": []
    },
    "gui" :{
        "notebook": true,
        "plotlib": null,
        "pyqtmaxplots": 100,
        "defaultcolormap": "hot"
    },
    "plotting":{
        "default_color_map": "viridis",
        "rasterize_threshold": 5000,
        "auto_color_scale":{
            "enabled": false,
            "cutoff_percentile": [0.5, 0.5],
            "color_over": "#a1c4fc",
            "color_under": "#017000"
        }
    },
    "user": {
        "scriptfolder": ".",
        "mainfolder": "."
    },
    "station": {
        "enable_forced_reconnect": false,
        "default_folder": ".",
        "default_file": null,
        "use_monitor": false
    },
    "GUID_components": {
        "GUID_type": "random_sample",
        "location": 0,
        "work_station": 0,
        "sample": 0
    },
    "dataset": {
        "write_in_background": false,
        "write_period": 5.0,
        "use_threads": false,
        "dond_plot": false,
        "dond_show_progress": false,
        "callback_percent" : 5.0,
        "export_automatic": false,
        "export_type": null,
        "export_prefix": "qcodes_",
        "export_path": "{db_location}",
        "export_name_elements": ["captured_run_id", "guid"],
        "export_chunked_export_of_large_files_enabled": false,
        "export_chunked_threshold": 1000,
        "in_memory_cache": true,
        "load_from_exported_file": false,
        "raw_data_backend": "sqlite_main_db",
        "raw_data_backend_config": {
            "sqlite_per_dataset_db": {
                "raw_data_path": "{db_location}"
            }
        }
    },
    "telemetry":
    {
        "enabled": false,
        "instrumentation_key": "00000000-0000-0000-0000-000000000000"
    }
}
